{
  "$schema": "http://json-schema.org/draft-07/schema#",
  "$id": "https://github.com/yao23/agent-experience-graph/experiments/public-repair-lab/paired-results.schema.json",
  "title": "AEG sanitized paired Repair Lab results",
  "type": "object",
  "additionalProperties": false,
  "required": ["schemaVersion", "experimentId", "sourceReportCreatedAt", "patchHashAlgorithm", "expectedPatchSha256", "trials", "aggregate", "unavailableMetadata", "limitations"],
  "properties": {
    "schemaVersion": {"const": "1.0.0"},
    "experimentId": {"type": "string", "minLength": 1},
    "sourceReportCreatedAt": {"type": "string", "pattern": "^[0-9]{4}-[0-9]{2}-[0-9]{2}T"},
    "patchHashAlgorithm": {"const": "sha256"},
    "expectedPatchSha256": {"type": "string", "pattern": "^[a-f0-9]{64}$"},
    "trials": {"type": "array", "minItems": 1, "items": {"$ref": "#/definitions/trial"}},
    "aggregate": {"$ref": "#/definitions/aggregate"},
    "unavailableMetadata": {"type": "array", "items": {"type": "string", "minLength": 1}},
    "limitations": {"type": "array", "minItems": 1, "items": {"type": "string", "minLength": 1}}
  },
  "definitions": {
    "nullableSha": {"anyOf": [{"type": "null"}, {"type": "string", "pattern": "^[a-f0-9]{40}$"}]},
    "nullableString": {"anyOf": [{"type": "null"}, {"type": "string", "minLength": 1}]},
    "runtime": {
      "type": "object", "additionalProperties": false,
      "required": ["codexCliVersion", "sessionMode", "sandbox"],
      "properties": {"codexCliVersion": {"$ref": "#/definitions/nullableString"}, "sessionMode": {"const": "ephemeral"}, "sandbox": {"const": "workspace-write"}}
    },
    "arm": {
      "type": "object", "additionalProperties": false,
      "required": ["verified", "completedCommands", "actualTestExecutions", "nonCachedTokens", "durationMs", "patchSha256"],
      "properties": {
        "verified": {"type": "boolean"},
        "completedCommands": {"type": "integer", "minimum": 0},
        "actualTestExecutions": {"type": "integer", "minimum": 0},
        "nonCachedTokens": {"type": "integer", "minimum": 0},
        "durationMs": {"type": "integer", "minimum": 0},
        "patchSha256": {"type": "string", "pattern": "^[a-f0-9]{64}$"}
      }
    },
    "trial": {
      "type": "object", "additionalProperties": false,
      "required": ["trialId", "taskId", "executionOrder", "runnerSourceCommitSha", "model", "runtime", "arms"],
      "properties": {
        "trialId": {"type": "string", "minLength": 1},
        "taskId": {"type": "string", "minLength": 1},
        "executionOrder": {"type": "array", "items": {"enum": ["baseline", "assisted"]}, "minItems": 2, "maxItems": 2},
        "runnerSourceCommitSha": {"$ref": "#/definitions/nullableSha"},
        "model": {"$ref": "#/definitions/nullableString"},
        "runtime": {"$ref": "#/definitions/runtime"},
        "arms": {
          "type": "object", "additionalProperties": false, "required": ["baseline", "assisted"],
          "properties": {"baseline": {"$ref": "#/definitions/arm"}, "assisted": {"$ref": "#/definitions/arm"}}
        }
      }
    },
    "countPair": {
      "type": "object", "additionalProperties": false, "required": ["baseline", "assisted"],
      "properties": {"baseline": {"type": "integer", "minimum": 0}, "assisted": {"type": "integer", "minimum": 0}}
    },
    "deltas": {
      "type": "object", "additionalProperties": false,
      "required": ["completedCommands", "actualTestExecutions", "nonCachedTokens", "durationMs"],
      "properties": {"completedCommands": {"type": "number"}, "actualTestExecutions": {"type": "number"}, "nonCachedTokens": {"type": "number"}, "durationMs": {"type": "number"}}
    },
    "aggregate": {
      "type": "object", "additionalProperties": false,
      "required": ["armCounts", "verifiedCounts", "pairedMedianAssistedMinusBaseline"],
      "properties": {"armCounts": {"$ref": "#/definitions/countPair"}, "verifiedCounts": {"$ref": "#/definitions/countPair"}, "pairedMedianAssistedMinusBaseline": {"$ref": "#/definitions/deltas"}}
    }
  }
}
